{
  "budget": {
    "allocated": {
      "externalCalls": 50,
      "timeMs": 1500,
      "tokens": 2000
    },
    "children": [],
    "consumed": {
      "externalCalls": 3,
      "timeMs": 108,
      "tokens": 812
    },
    "remaining": {
      "externalCalls": 47,
      "timeMs": 1392,
      "tokens": 1188
    },
    "scope": "pipeline",
    "termination": {
      "code": "ok"
    }
  },
  "diagnostics": {
    "codes": [
      "pipeline.succeeded"
    ],
    "counters": {},
    "kv": {},
    "notes": []
  },
  "error": null,
  "manifestRef": {
    "manifestHash": "sha256:2222222222222222222222222222222222222222222222222222222222222222",
    "runId": "2026-01-23T10:00:00Z/abcd"
  },
  "output": {
    "decision": "pass"
  },
  "pipeline": {
    "id": "summarize.v2"
  },
  "runId": "2026-01-23T10:00:00Z/abcd",
  "schemaVersion": "1.0.0",
  "stageSummaries": [
    {
      "codes": [
        "ok"
      ],
      "stageId": "verify",
      "status": "ok",
      "timeMs": 10
    }
  ],
  "status": "ok",
  "warnings": []
}
